### ISSUE TITLE
HomeBase Professional S1 (T9000) P2P live-stream connection timeout

### ISSUE THREAD

**Issue by AsmaHimri2012** [mega-yfue/eufy-sdk#221]
### Model code

T9000

### Topology

Four T8142-R cameras and one T8170 camera attached to a T9000 HomeBase Professional S1. The SDK bridge and HomeBase are on the same local network.

### What is missing

Live streaming is unavailable for cameras attached to the T9000 HomeBase Professional S1.

The SDK resolves the HomeBase and all cameras correctly, and the bridge authenticates successfully:

```text
[bridge] ready — 6 devices, 6 camera stream(s)
[bridge] logged in from a stored session

### What the device reports

```json
**What the device reports**


Model: T9000
Product: HomeBase Professional S1
Role: HomeBase/station
Local service: _securityp2p._udp.local
Reported service family: homebase3
Reported local protocol version: 1.1.0

Attached camera models:
- T8142-R
- T8170

The account and devices resolve successfully. Device properties and entities are exposed, but opening a camera stream fails with a P2P connection timeout.
```

### Before submitting

- [x] I removed every serial, device id, account id and IP address from this report

**Comment by danymexi** [comment]
Pointer, since the SDK side of this may not be reading the bridge tracker: there are now three captures on a real T9000 in mega-yfue/ha-eufy-sdk-bridge#39, and they narrow the failure quite a bit.

- The session fails **with no cameras paired at all**, so a station-routed child camera is a symptom rather than a precondition for reproducing.
- Header census against a T8030 on the same LAN, same bridge process: the T9000 receives **59 frames, all `f141`** — never an `f143`, never a keepalive. The working station shows the opposite profile.
- Possible lead: the `f141` answers come from four LAN addresses and **none of them is the T9000**, which reports `state.ipAddress` on a fifth. Both hosts answer ICMP and both have UDP 32100 open, so it isn't basic reachability.
- What the timeout actually costs: **detection still works** (it rides the cloud push channel), while `/event-image` and live view both fail, because both need a station-side fetch. Fixing the session should restore the two together.

`@mega-yfue/eufy-sdk@0.3.0-beta.0`, so mega-yfue/eufy-sdk#192 is in and the station classifies correctly — this is purely the connect half.

Hardware is here and unpaired-to-nothing-else, so I can run whatever capture would help.

**Comment by lenoxys** [comment]
I think the best is to run capture between your phone and HomeBase s1

Im using mitm with WireGuard to achieve that

**Comment by Malvorak1914** [comment]
Encountering the same issue as above. Looks like P2P requests are going out, but no replies are returned.

Cameras: T8213, two T8124, T8W11, two T8170

logs/tcpdump: outbound UDP to 34.232.175.106, 13.56.217.188, 18.190.223.84:32100 succeeds, zero replies ever received
login OK 
eufy error: P2P connect timeout for T9000xxx
T8213xxx: snapshotLive error station T9000xxx's P2P session did not connect within 15060ms, so nothing could be sent to it 
eufy error: P2P connect timeout for T9000xxx
T8124xxx: snapshotLive error station T9000xxx's P2P session did not connect within 15032ms, so nothing could be sent to it 
eufy error: P2P connect timeout for T9000xxx
T8124xxx: snapshotLive error station T9000xxx's P2P session did not connect within 15036ms, so nothing could be sent to it 
eufy error: P2P connect timeout for T9000xxx
T8W11Txxx: snapshotLive error station T9000xxx's P2P session did not connect within 15036ms, so nothing could be sent to it 
eufy error: P2P connect timeout for T9000xxx
T8170xxx: snapshotLive error station T9000xxx's P2P session did not connect within 15024ms, so nothing could be sent to it 

sudo tcpdump -ni wlan0 udp port 32100 or \( udp and src 34.232.175.106 \) or \( udp and src 13.56.217.188 \) or \( udp and s
rc 18.190.223.84 \) 
tcpdump: verbose output suppressed, use -v[v]... for full protocol decode 
listening on wlan0, link-type EN10MB (Ethernet), snapshot length 262144 bytes 
13:53:27.324067 IP 172.16.0.71.55008 > 34.232.175.106.32100: UDP, length 68 
13:53:27.325970 IP 172.16.0.71.55008 > 13.56.217.188.32100: UDP, length 68 
13:53:27.327156 IP 172.16.0.71.55008 > 18.190.223.84.32100: UDP, length 68 
13:53:30.945746 IP 172.16.0.71.55979 > 34.232.175.106.32100: UDP, length 48 
13:53:30.946851 IP 172.16.0.71.55979 > 13.56.217.188.32100: UDP, length 48 
13:53:30.947913 IP 172.16.0.71.55979 > 18.190.223.84.32100: UDP, length 48 
13:53:31.946096 IP 172.16.0.71.55979 > 34.232.175.106.32100: UDP, length 68 
13:53:31.946846 IP 172.16.0.71.55979 > 13.56.217.188.32100: UDP, length 68 
13:53:31.947231 IP 172.16.0.71.55979 > 18.190.223.84.32100: UDP, length 68 
13:53:32.946864 IP 172.16.0.71.55979 > 34.232.175.106.32100: UDP, length 68 
13:53:32.947567 IP 172.16.0.71.55979 > 18.190.223.84.32100: UDP, length 68 
13:53:32.948005 IP 172.16.0.71.55979 > 13.56.217.188.32100: UDP, length 68 

14:12:25.343189 IP 172.20.10.4.47162 > 18.190.223.84.32100: UDP, length 68
14:12:25.343865 IP 172.20.10.4.47162 > 13.56.217.188.32100: UDP, length 68
14:12:26.335281 IP 172.20.10.4.47162 > 34.232.175.106.32100: UDP, length 68
14:12:26.376378 IP 172.20.10.4.47162 > 18.190.223.84.32100: UDP, length 68
14:12:26.376647 IP 172.20.10.4.47162 > 13.56.217.188.32100: UDP, length 68
14:12:27.334770 IP 172.20.10.4.47162 > 34.232.175.106.32100: UDP, length 68
14:12:27.343501 IP 172.20.10.4.47162 > 13.56.217.188.32100: UDP, length 68
14:12:27.344155 IP 172.20.10.4.47162 > 18.190.223.84.32100: UDP, length 68
14:12:28.335616 IP 172.20.10.4.47162 > 34.232.175.106.32100: UDP, length 68
14:12:28.359760 IP 172.20.10.4.47162 > 18.190.223.84.32100: UDP, length 68
14:12:28.360785 IP 172.20.10.4.47162 > 13.56.217.188.32100: UDP, length 68

Tested on two independent networks (home ISP + phone hotspot), both single-NAT with a normal public IP, UPnP enabled — rules out local NAT/firewall
SDK version 0.2.0, Node 24.21.0, Raspberry Pi OS

**Comment by danymexi** [comment]
@lenoxys took your suggestion. Captured the official eufy app against my own T9000 tonight, and the result reframes this issue: **the station does P2P fine. The app streams live video from it. It's our path to it that fails.**

## Method

No MITM in the end — my router (a FRITZ!Box) has a built-in packet capture, and its WireGuard interface sees exactly the phone's traffic and nothing else. Phone on cellular with the home VPN up, so every packet the app sent went through that interface.

Captured while asking the app for a live view of the T9000. 60,812 packets, of which 2,135 on UDP 32100.

*(One practical note for anyone repeating this: the FRITZ!Box writes its pcap with link-type 14, which `tcpdump` on macOS rejects as unknown. Rewriting the 4 bytes at offset 20 to 101 — `LINKTYPE_RAW` — makes it readable, nothing else needs touching.)*

## The PPCS lookup answers the app

| server | sent | **received** |
|---|---|---|
| `18.197.212.165` | 388 | **341** |
| `15.236.219.167` | 388 | **338** |
| `13.251.222.7` | 388 | **188** |
| six more | 5–10 each | 7–14 each |

Compare with @Malvorak1914's capture above, where the SDK sent to `34.232.175.106`, `13.56.217.188`, `18.190.223.84` and received **zero** replies. Those are US regions; the ones answering my app are Frankfurt, Paris and Singapore. Worth checking whether the endpoint set is chosen per account region and whether the SDK picks the same one the app does — on my own bridge runs I *did* see inbound `f182` frames from `18.197.212.165`, so at least that endpoint answers the SDK too.

## Then the app opens a direct session with the station

```
23:51:31.746  192.168.178.142.59802 > 192.168.178.204.59346: UDP, length 104
   …
23:55:58.906  192.168.178.204.45403 > 192.168.178.142.47470: UDP, length 32
```

`.142` is the T9000, `.204` is the phone on the VPN. Four minutes, **4,025 UDP packets**, across four negotiated port pairs:

| port pair | packets |
|---|---|
| `50804 ↔ 48932` | 3,406 |
| `59802 ↔ 59346` | 424 |
| `47470 ↔ 45403` | 99 |
| `52733 ↔ 34070` | 96 |

The 3,406-packet pair is the video. Ordinary PPCS hole-punching onto ephemeral ports, and the station holds the session for as long as the app wants it.

**Nothing on port 32100 with the station at all** — the lookup happens with the cloud, and the session that follows is direct to the LAN address on negotiated ports.

## What this means for the issue

The T9000 is not refusing P2P, and it is not a device that "doesn't support live view". On the same network, the same evening, the same station:

- official app → lookup answered, direct session established, video for four minutes
- SDK → `P2P connect timeout for T9000…` after 15 s, never a frame beyond the lookup exchange

So the question is narrower than it looked: **what does the app send that we don't, or which endpoint does it use that we don't?** I can't answer that from a capture of one side — but whoever knows the SDK's lookup path now has a known-good counterexample to compare against, on hardware that fails.

I'm not attaching the pcap: it's my account's traffic. Happy to pull specific fields out of it on request — frame sizes, the exact lookup exchange, timings, whatever helps. The capture is reproducible in about two minutes now that the method works.

**Comment by danymexi** [comment]
## Correction, and I think the answer

I need to withdraw the central claim of my comment above. I wrote that the app's four-minute session with the T9000 was "ordinary PPCS hole-punching onto ephemeral ports" and that the 3,406-packet port pair was the video. I read the port numbers and the packet counts and never read the payloads. Both statements are wrong.

**The app does not speak PPCS to this station at all.** Going back through the same capture and keying on the first bytes of every datagram:

```
frames exchanged with 192.168.178.142 (the T9000), whole capture:
  PPCS-framed (0xf1xx) ............ 0
  STUN magic cookie 0x2112A442 .... 1684
  RTP / RTCP (0x80xx, 0x9exx) ..... 55
  0x0100 / 0x0300, body zero-filled  2285
```

Not one `f1xx` frame in either direction. The binding requests carry `0x0024` PRIORITY and `0x802A` ICE-CONTROLLING, so it is ICE, not bare STUN:

```
0001 0054 2112a442 f67de7e25e27195dd5e96f36 0024 0004 6e7fffff 802a 0008 …
^type ^len ^cookie  ^transaction id          ^PRIORITY        ^ICE-CONTROLLING
```

The same capture contains its own control: the rest of the fleet is pure PPCS in the same minutes — 12,679 `f1d0` frames inbound, 6,478 of them from one LAN device at `192.168.178.63`, with `f1d1`, `f1e0`/`f1e1` alongside. **The app speaks both protocols and chooses per device.**

### And the video wasn't on that path either

I said the 3,406-packet pair was the stream. It's 817 KB over four minutes — about 27 kbit/s, which is not video. The whole direct UDP session with the station is 0.97 MB. What runs alongside it is this:

| flow | bytes | window |
|---|---|---|
| UDP, phone ↔ station `.142` | 0.97 MB | 23:51:31 → 23:55:58 |
| **TCP 443 to `3.78.104.103`** | **9.62 MB** | **23:51:31 → 23:55:56** |

Same second in, same second out, ~290 kbit/s. It's TLS so I can't read it, and I'm stating this as correlation rather than proof — but the direct path demonstrably isn't carrying it, and that flow is the only thing in the capture that is the right size at the right time.

So the encouraging line in my comment above — "the station is not refusing P2P, there's a known-good counterexample" — doesn't survive. There is no PPCS counterexample. The station never does PPCS with anyone.

## What the SDK does, measured on the same hardware

Capture on the bridge host, all UDP this time rather than just port 32100.

**Local path.** `LOCAL_LOOKUP` (`0xf130`) to `192.168.178.142:32108`, 15 attempts, and the station answers every one of them:

```
19:25:38.541  192.168.178.166.56858 > 192.168.178.142.32108: UDP, length 6
19:25:38.542  192.168.178.142 > 192.168.178.166: ICMP udp port 32108 unreachable
   … 15/15, one per lookup tick
```

It doesn't implement the legacy LAN lookup port. It does announce itself on eufy's own mDNS group:

```
192.168.178.142.25353 > 224.0.0.249.25353
  T9000P2026220AA6._legacy._homebase3
```

**Cloud path.** `sendLookups` logs the pool each station gets from its own record, and they differ per station:

| station | pool from the station record | replied |
|---|---|---|
| T8010 (HomeBase 1) | `18.197.212.165`, `p2p-sgp`, `p2p-par` | yes |
| T8030 (HomeBase 3) | `3.124.97.151`, `p2p-sgp-2`, `p2p-par-2` | yes |
| T8030 (HomeBase 3) | `18.199.58.87`, `p2p-par-4`, `p2p-sto-4` | yes |
| **T9000 (S1 Pro)** | `51.102.195.104`, `p2p-par-5` → `13.39.244.20`, `p2p-sto-5` → `13.62.197.188` | **none** |

Every pool that answered did so within ~2 ms. The "-5" pool returned nothing to 15 `LOOKUP_WITH_KEY` plus one `LOOKUP_WITH_KEY2` on each host — not even an ICMP. The official app never resolves a `p2p-*-N.anker-in.com` name at all; it goes straight to the unnumbered set for everything.

**I forced the working pool in.** Patched `decodeP2PCloudIPs` to append the three the app uses, rebuilt, re-ran:

```js
result.push({ host: ip, port: 32100 });
for (const h of ["18.197.212.165", "15.236.219.167", "13.251.222.7"])
  if (!result.some((r) => r.host === h)) result.push({ host: h, port: 32100 });
```

The traffic changes and the servers do answer — `f121` ×36 on the T9000's socket, where before there was silence. But never `f140` or `f182`, so `parseLookupAddr` → `beginCheckCam` never fires and it still times out at 15 s. Which fits: there is no PPCS endpoint for this station to hand out.

## One thing I didn't expect to find

On this account, in these captures, **no station has ever connected through the cloud path.** Every address that led to a connect arrived as `LOCAL_LOOKUP_RESP` from a `192.168.x` address. The cloud path yields `f169` (a relay-pool listing) and `f182`, and stops there.

The three older stations work because they answer on 32108. The S1 Pro doesn't, and has nothing behind it.

## What I think this means

This doesn't look like a bug in the connect path. The S1 Pro isn't a PPCS device — it's ICE/WebRTC with cloud signalling, and the media appears to ride a TLS relay. No amount of work in `p2p-session.ts` reaches it. That seems worth knowing before more time goes into the PPCS side of it.

Two smaller things that stand on their own regardless:

- the "-5" pool being silent is a fault in its own right — any station handed that pool has no cloud path at all, S1 Pro or not
- `f121` is unmodelled, and it's the ordinary answer to `LOOKUP_WITH_KEY` in the app's flow too (720 of them in the app capture)

If it's useful I can go after the signalling channel next — the app's HTTPS and MQTT around 23:51 are in the same capture, and whatever carries the SDP is in there. Hardware stays available: the S1 Pro, three older stations, 26 cameras.

**Comment by danymexi** [comment]
One clarification on my last comment, before someone acts on it.

I wrote that "no station has ever connected through the cloud path" on this account, and while that's literally what the captures show — every address that led to a connect arrived as `LOCAL_LOOKUP_RESP` from a `192.168.x` host — it reads like a claim that the cloud path is broken. It isn't one, and I can't support that.

`sendLookups` fires the local and the cloud lookup on the same tick and connects on whichever answers first. Every station here is on the same L2 as the bridge, so the LAN reply wins the race every time, by milliseconds. The cloud path losing that race is the design working, not a defect — and the three older stations do get `f182` back from their pools, which is the response the SDK acts on.

What stands is the narrower statement: the S1 Pro has no local path at all (ICMP unreachable on 32108), so for that station the race has only one runner, and it never finishes.

The silent "-5" pool is real and separate; I've split it out into #241 rather than leave it tangled up here.

**Comment by danymexi** [comment]
## The missing piece has already been built — by someone else, on the old stack

Following up on the ICE finding. I went looking for prior art before proposing anything, and there is a working implementation of the S1 Pro control path: **[genomez/eufy-security-client](https://github.com/genomez/eufy-security-client) `T9000-testing`** (MIT, a fork of bropat's client), shipped as an HA add-on in [genomez/hassio-eufy-security-ws](https://github.com/genomez/hassio-eufy-security-ws) and in daily use on real T9000s since July. Design notes are in [`T9000-WEBRTC.md`](https://github.com/genomez/hassio-eufy-security-ws/blob/main/T9000-WEBRTC.md); I've read the code, not just the notes.

### The protocol, as implemented there

```
GET https://security-smart[-eu].eufylife.com/v1/smart/nvr/ws/sign
    headers: X-Auth-Token (mega token), GToken = md5(user_id), App-Name: eufy_mega,
             Model-Type: WEB, Web-Country: <account country>
    → sign blob

WSS  security-smart[-eu].eufylife.com/v1/rtc/ws/join?reqtype=nvr
    subprotocols: ["v1", base64url({region, type:"NVR", sn, token, gtoken, sign,
                                     appName:"eufy_mega", modelType:"WEB"})]
    envelope { msgid, data: "<inner JSON>" }; inner { action, dataType, sn, sessionId, … }
    action 1 = auth (carries the sign), action 3 / dataType "scall" = session call

SDP offer/answer over that socket → ICE → DTLS → SCTP data channels:
    WebrtcDataChannel   commands — the same 1350 SET_PAYLOAD / 1224 frames, re-wrapped
                        in a "portal packet" (rtcPacket.ts) with a segment counter
    notify              station-originated frames
    video / audio / idr / download   declared, not implemented
```

Inside the data channel eufy runs its own SCTP-like framing (they carry a `libsctp` WASM for it). The peer is `node-datachannel` (libdatachannel), which ships musl prebuilds, so it would run in the bridge's `node:24-alpine` image. ICE works either through eufy's TURN (`turn:13.248.157.102:3478`, realm `anker.com`) or — the interesting part — as **plain LAN host candidates** (`RTC_NO_TURN=1`), which is exactly what my capture showed the app doing to `192.168.178.142`.

### Region matters, and it's the part that bit an EU user

The production build (`3.0.18-wake-v9`, from `T9000-testing`) hardcodes `security-smart.eufylife.com` + `region: US`. An FR account gets `401 token not exist` on the sign call (genomez/hassio-eufy-security-ws#2). The fix — worked out live with an FR tester over ~10 test builds — is on the `regional-rtc-*` branches (`regional-rtc-unified-v1`, 2026-09-15):

- sign + WS host → `security-smart-eu.eufylife.com` for eu-pr accounts
- HTTP header `Web-Country: FR` (the account country)
- but the WS subprotocol `region` is the **cluster**, `"EU"`, not the country — sending `FR` there fails after a successful sign

With that, guard-mode read/write over RTC is confirmed on an FR T9000 (fw 4.2.4.2), SCTP flowing both ways. That's the same eu-pr cluster this station is on (every `app-*-eu-pr.eufy.com` in my capture CNAMEs to `mega-eu-pr.ankersmartdns.com` → the Frankfurt ELB).

### What it does and doesn't give

| | |
|---|---|
| guard mode read/write, camera privacy (`enabled`), floodlight, PTZ | **works**, over `WebrtcDataChannel` |
| motion / person events, thumbnails, face names | works — but via cloud push (`1317/1318`), not RTC |
| live video from cameras behind the T9000 | **not implemented** anywhere yet; the `video`/`idr` channels exist in the SDP and nobody has driven them |
| session lifetime | app-data goes quiet after ~360 s; production uses a make-before-break re-session at 270 s |

So this is the control plane the S1 Pro is missing here, not the media plane. For what this SDK's users hit first — `armingMode` on an S1 Pro, siren, attached-camera settings — it's the whole answer; for live view it's the transport the answer will ride on.

### Two more facts from my side, for whoever picks this up

- The station advertises itself on eufy's mDNS group as `_securityp2p._udp.local` **port 9001**, TXT `{bind_code, bind_ts, ip_addr, name, sn, version: "1.1.0"}`. A PPCS `LOCAL_LOOKUP` to that port gets no answer, so it isn't the old protocol on a new port — but a LAN service with a bind code is exactly the shape of a local signalling endpoint, and it would remove the cloud from the loop entirely. Unexplored.
- On the app side the 4-minute live view moved ~9.6 MB over TLS to `app-push-eu-pr.eufy.com` (a plain mega cluster host), in the same window as the ICE session. If the media really rides that HTTPS path rather than the data channel, "live view" may be a different problem from "RTC" altogether.

### Proposal

A `transport/rtc` module in this SDK for `STATION_9000`: signalling client + `node-datachannel` peer + the SCTP framer + a command sink that wraps the existing station frames. genomez's code is MIT and structured almost the way this SDK would want it (signalling / session / peer / framer / command bridge are separate files, ~4.3k lines incl. tests). The native dependency is the one real decision — the SDK has none today.

I can start the port on a branch if that's a direction you'd take; I'd rather hear that first than show up with a native dep in a PR. Hardware and an eu-pr account are here for every test it needs.

**Comment by danymexi** [comment]
Started it, as a draft so the two decisions land with you before the code does: **#243** — the session layer of a `transport/rtc` for `STATION_9000`, written for this SDK's layout from the path genomez runs in production.

What's in it: signalling (with the EU host/cluster split that bit the FR tester), the scall-JSON ↔ SDP translation, a `node-datachannel` answerer with host-only ICE, the `XZYH` portal packet codec, and a **clean-room PTCS framer** — the portal ships its packetiser as a WASM blob and this SDK can't carry that, so I recorded the module's input/output offline and wrote the format from it; the spec pins every recorded packet byte for byte. 53 specs, all offline; the full suite is green.

Not in it yet: the command-router branch and the inbound bridge — I'd rather wire those after the exchange is confirmed live from this SDK's own login, which is the next run here (T9000 + eu-pr account).

The two things I can't decide for you are in the PR text: the native dependency, and how you want the provenance of the PTCS format stated.
